{"$schema":"https://json-schema.org/draft/2020-12/schema","$id":"https://example.invalid/screenshot-liquid-symbiosis/tokens.schema.json","title":"Screenshot Liquid Symbiosis candidate tokens (custom format)","type":"object","additionalProperties":false,"required":["$schema","$meta","color","radius","size","type","space","state","motion","layout","scroll","demo"],"properties":{"$schema":{"type":"string","minLength":1},"$meta":{"type":"object","additionalProperties":false,"required":["name","version","status","date","unit","baseline","designSource","note"],"properties":{"name":{"type":"string","minLength":1},"version":{"type":"string","minLength":1},"status":{"type":"string","minLength":1},"date":{"type":"string","minLength":1},"unit":{"type":"string","minLength":1},"baseline":{"type":"string","minLength":1},"designSource":{"type":"string","minLength":1},"note":{"type":"string","minLength":1}}},"color":{"type":"object","additionalProperties":false,"required":["accent","accentTop","accentBottom","ink","muted","well","canvas","surfaceTop","surfaceMid","surfaceBottom","surfaceBase","raisedTop","raisedBottom","focusFill","error","warning","success","mask"],"properties":{"accent":{"type":"string","pattern":"^#[0-9a-fA-F]{6}([0-9a-fA-F]{2})?$"},"accentTop":{"type":"string","pattern":"^#[0-9a-fA-F]{6}([0-9a-fA-F]{2})?$"},"accentBottom":{"type":"string","pattern":"^#[0-9a-fA-F]{6}([0-9a-fA-F]{2})?$"},"ink":{"type":"string","pattern":"^#[0-9a-fA-F]{6}([0-9a-fA-F]{2})?$"},"muted":{"type":"string","pattern":"^#[0-9a-fA-F]{6}([0-9a-fA-F]{2})?$"},"well":{"type":"string","pattern":"^#[0-9a-fA-F]{6}([0-9a-fA-F]{2})?$"},"canvas":{"type":"string","pattern":"^#[0-9a-fA-F]{6}([0-9a-fA-F]{2})?$"},"surfaceTop":{"type":"string","pattern":"^#[0-9a-fA-F]{6}([0-9a-fA-F]{2})?$"},"surfaceMid":{"type":"string","pattern":"^#[0-9a-fA-F]{6}([0-9a-fA-F]{2})?$"},"surfaceBottom":{"type":"string","pattern":"^#[0-9a-fA-F]{6}([0-9a-fA-F]{2})?$"},"surfaceBase":{"type":"string","pattern":"^#[0-9a-fA-F]{6}([0-9a-fA-F]{2})?$"},"raisedTop":{"type":"string","pattern":"^#[0-9a-fA-F]{6}([0-9a-fA-F]{2})?$"},"raisedBottom":{"type":"string","pattern":"^#[0-9a-fA-F]{6}([0-9a-fA-F]{2})?$"},"focusFill":{"type":"string","pattern":"^#[0-9a-fA-F]{6}([0-9a-fA-F]{2})?$"},"error":{"type":"string","pattern":"^#[0-9a-fA-F]{6}([0-9a-fA-F]{2})?$"},"warning":{"type":"string","pattern":"^#[0-9a-fA-F]{6}([0-9a-fA-F]{2})?$"},"success":{"type":"string","pattern":"^#[0-9a-fA-F]{6}([0-9a-fA-F]{2})?$"},"mask":{"type":"string","pattern":"^#[0-9a-fA-F]{6}([0-9a-fA-F]{2})?$"}}},"radius":{"type":"object","additionalProperties":false,"required":["control","floating","rail","pill"],"properties":{"control":{"type":"number","minimum":0},"floating":{"type":"number","minimum":0},"rail":{"type":"number","minimum":0},"pill":{"type":"number","minimum":0}}},"size":{"type":"object","additionalProperties":false,"required":["control","compact","icon","handle","selectionBorder","railPadding","railGap","cardWidth","textCardWidth"],"properties":{"control":{"type":"number","minimum":0},"compact":{"type":"number","minimum":0},"icon":{"type":"number","minimum":0},"handle":{"type":"number","minimum":0},"selectionBorder":{"type":"number","minimum":0},"railPadding":{"type":"number","minimum":0},"railGap":{"type":"number","minimum":0},"cardWidth":{"type":"number","minimum":0},"textCardWidth":{"type":"number","minimum":0}}},"type":{"type":"object","additionalProperties":false,"required":["heading","title","body","label"],"properties":{"heading":{"type":"number","minimum":0},"title":{"type":"number","minimum":0},"body":{"type":"number","minimum":0},"label":{"type":"number","minimum":0}}},"space":{"type":"object","additionalProperties":false,"required":["xs","sm","md","lg","xl","section"],"properties":{"xs":{"type":"number","minimum":0},"sm":{"type":"number","minimum":0},"md":{"type":"number","minimum":0},"lg":{"type":"number","minimum":0},"xl":{"type":"number","minimum":0},"section":{"type":"number","minimum":0}}},"state":{"type":"object","additionalProperties":false,"required":["disabledOpacity"],"properties":{"disabledOpacity":{"type":"number","minimum":0}}},"motion":{"type":"object","additionalProperties":false,"required":["duration","easing","spring","solver","proximity","bridge","press","intensity","reduced","quality","budget","policy"],"properties":{"duration":{"type":"object","additionalProperties":false,"required":["press","release","panelEnter","panelExit","content","selectionTransfer","bridge","toast","toastHold","exit","reducedFade","tooltipDelay"],"properties":{"press":{"type":"number","minimum":0},"release":{"type":"number","minimum":0},"panelEnter":{"type":"number","minimum":0},"panelExit":{"type":"number","minimum":0},"content":{"type":"number","minimum":0},"selectionTransfer":{"type":"number","minimum":0},"bridge":{"type":"number","minimum":0},"toast":{"type":"number","minimum":0},"toastHold":{"type":"number","minimum":0},"exit":{"type":"number","minimum":0},"reducedFade":{"type":"number","minimum":0},"tooltipDelay":{"type":"number","minimum":0}}},"easing":{"type":"object","additionalProperties":false,"required":["enter","exit","inOut"],"properties":{"enter":{"type":"array","items":{"type":"number","minimum":0},"minItems":4,"maxItems":4},"exit":{"type":"array","items":{"type":"number","minimum":0},"minItems":4,"maxItems":4},"inOut":{"type":"array","items":{"type":"number","minimum":0},"minItems":4,"maxItems":4}}},"spring":{"type":"object","additionalProperties":false,"required":["attention","neighbor","body","press","indicator","panel"],"properties":{"attention":{"type":"object","additionalProperties":false,"required":["stiffness","damping"],"properties":{"stiffness":{"type":"number","minimum":0},"damping":{"type":"number","minimum":0}}},"neighbor":{"type":"object","additionalProperties":false,"required":["stiffness","damping"],"properties":{"stiffness":{"type":"number","minimum":0},"damping":{"type":"number","minimum":0}}},"body":{"type":"object","additionalProperties":false,"required":["stiffness","damping"],"properties":{"stiffness":{"type":"number","minimum":0},"damping":{"type":"number","minimum":0}}},"press":{"type":"object","additionalProperties":false,"required":["stiffness","damping"],"properties":{"stiffness":{"type":"number","minimum":0},"damping":{"type":"number","minimum":0}}},"indicator":{"type":"object","additionalProperties":false,"required":["stiffness","damping"],"properties":{"stiffness":{"type":"number","minimum":0},"damping":{"type":"number","minimum":0}}},"panel":{"type":"object","additionalProperties":false,"required":["stiffness","damping"],"properties":{"stiffness":{"type":"number","minimum":0},"damping":{"type":"number","minimum":0}}}}},"solver":{"type":"object","additionalProperties":false,"required":["stepMax","elapsedMax","positionEpsilon","velocityEpsilon","sleepFrames"],"properties":{"stepMax":{"type":"number","minimum":0},"elapsedMax":{"type":"number","minimum":0},"positionEpsilon":{"type":"number","minimum":0},"velocityEpsilon":{"type":"number","minimum":0},"sleepFrames":{"type":"number","minimum":0}}},"proximity":{"type":"object","additionalProperties":false,"required":["radius","localX","localY","maxTotalShift","neighbor1","neighbor2","bodyShift","bodyBulge","faceStretch","hoverScale","leaveThreshold"],"properties":{"radius":{"type":"number","minimum":0},"localX":{"type":"number","minimum":0},"localY":{"type":"number","minimum":0},"maxTotalShift":{"type":"number","minimum":0},"neighbor1":{"type":"number","minimum":0},"neighbor2":{"type":"number","minimum":0},"bodyShift":{"type":"number","minimum":0},"bodyBulge":{"type":"number","minimum":0},"faceStretch":{"type":"number","minimum":0},"hoverScale":{"type":"number","minimum":0},"leaveThreshold":{"type":"number","minimum":0}}},"bridge":{"type":"object","additionalProperties":false,"required":["maxLinks","maxGap","neck","maxPanelSpan","opacity","minAttention","exclude","trigger"],"properties":{"maxLinks":{"type":"number","minimum":0},"maxGap":{"type":"number","minimum":0},"neck":{"type":"number","minimum":0},"maxPanelSpan":{"type":"number","minimum":0},"opacity":{"type":"number","minimum":0},"minAttention":{"type":"number","minimum":0},"exclude":{"type":"array","items":{"type":"string","minLength":1},"minItems":4,"maxItems":4},"trigger":{"type":"string","minLength":1}}},"press":{"type":"object","additionalProperties":false,"required":["scaleX","scaleY","neighborImpulse"],"properties":{"scaleX":{"type":"number","minimum":0},"scaleY":{"type":"number","minimum":0},"neighborImpulse":{"type":"number","minimum":0}}},"intensity":{"type":"object","additionalProperties":false,"required":["hero","editing","system","reading"],"properties":{"hero":{"type":"number","minimum":0},"editing":{"type":"number","minimum":0},"system":{"type":"number","minimum":0},"reading":{"type":"number","minimum":0}}},"reduced":{"type":"object","additionalProperties":false,"required":["translation","deformation","bridges","parallax","ambientLoop"],"properties":{"translation":{"type":"number","minimum":0},"deformation":{"type":"number","minimum":0},"bridges":{"type":"boolean"},"parallax":{"type":"boolean"},"ambientLoop":{"type":"boolean"}}},"quality":{"type":"object","additionalProperties":false,"required":["full","economy"],"properties":{"full":{"type":"object","additionalProperties":false,"required":["bridges","pointerGlow"],"properties":{"bridges":{"type":"boolean"},"pointerGlow":{"type":"boolean"}}},"economy":{"type":"object","additionalProperties":false,"required":["bridges","pointerGlow"],"properties":{"bridges":{"type":"boolean"},"pointerGlow":{"type":"boolean"}}}}},"budget":{"type":"object","additionalProperties":false,"required":["inputAcknowledgeTarget","releaseToFirstClickableTarget","releaseToAllClickableMax","settleMax","confirmedSuccessToHiddenMax","cancelToHiddenMax","reducedTransitionMax"],"properties":{"inputAcknowledgeTarget":{"type":"number","minimum":0},"releaseToFirstClickableTarget":{"type":"number","minimum":0},"releaseToAllClickableMax":{"type":"number","minimum":0},"settleMax":{"type":"number","minimum":0},"confirmedSuccessToHiddenMax":{"type":"number","minimum":0},"cancelToHiddenMax":{"type":"number","minimum":0},"reducedTransitionMax":{"type":"number","minimum":0}}},"policy":{"type":"object","additionalProperties":false,"required":["stationaryHitTargets","pressFreezesAttention","hoverNeverSelects","persistentActiveIndependent","noIdleLoop","systemReduceCannotBeOverridden","completeAfterHostAck","generationGuard"],"properties":{"stationaryHitTargets":{"type":"boolean"},"pressFreezesAttention":{"type":"boolean"},"hoverNeverSelects":{"type":"boolean"},"persistentActiveIndependent":{"type":"boolean"},"noIdleLoop":{"type":"boolean"},"systemReduceCannotBeOverridden":{"type":"boolean"},"completeAfterHostAck":{"type":"boolean"},"generationGuard":{"type":"boolean"}}}}},"layout":{"type":"object","additionalProperties":false,"required":["safeInset","panelGap","readerMinWidth","readerMinHeight","readerPreferredWidth","readerPreferredHeight","readerFontMin","readerFontMax"],"properties":{"safeInset":{"type":"number","minimum":0},"panelGap":{"type":"number","minimum":0},"readerMinWidth":{"type":"number","minimum":0},"readerMinHeight":{"type":"number","minimum":0},"readerPreferredWidth":{"type":"number","minimum":0},"readerPreferredHeight":{"type":"number","minimum":0},"readerFontMin":{"type":"number","minimum":0},"readerFontMax":{"type":"number","minimum":0}}},"scroll":{"type":"object","additionalProperties":false,"required":["thumb","hit","hideDelay","fade"],"properties":{"thumb":{"type":"number","minimum":0},"hit":{"type":"number","minimum":0},"hideDelay":{"type":"number","minimum":0},"fade":{"type":"number","minimum":0}}},"demo":{"type":"object","additionalProperties":false,"required":["taskMs","slowTaskMs","commitMs","sourceLocale","targetLocale","network","systemClipboard"],"properties":{"taskMs":{"type":"number","minimum":0},"slowTaskMs":{"type":"number","minimum":0},"commitMs":{"type":"number","minimum":0},"sourceLocale":{"type":"string","minLength":1},"targetLocale":{"type":"string","minLength":1},"network":{"type":"boolean"},"systemClipboard":{"type":"boolean"}}}}}
