{
  "$schema": "./tokens.schema.json",
  "$meta": {"name": "Screenshot / Liquid Symbiosis", "version": "1.0.0", "status": "design-prototype", "date": "2026-10-22", "unit": "CSS px / WPF DIP; milliseconds; mass=1", "baseline": "03dc2ef2f135e02b5131e1b9a0a46d89855f3ba2", "designSource": "e106d5ffe5e0392feadb95c8bcd34480675e6d15", "note": "Proposed motion values, not measured Windows performance. Existing production tokens are not overwritten."},
  "color": {"accent":"#3b82f6","accentTop":"#5b9bff","accentBottom":"#2563eb","ink":"#f5f5f7","muted":"#b7b5b3","well":"#181719","canvas":"#202022","surfaceTop":"#4a4642","surfaceMid":"#322f2c","surfaceBottom":"#2a2724","surfaceBase":"#1a1816","raisedTop":"#5a5550","raisedBottom":"#2c2926","focusFill":"#ffffff20","error":"#ffc3b6","warning":"#f5ce8e","success":"#b4dbbd","mask":"#00000080"},
  "radius":{"control":12,"floating":12,"rail":22,"pill":999},
  "size":{"control":40,"compact":36,"icon":18,"handle":12,"selectionBorder":1.25,"railPadding":8,"railGap":5,"cardWidth":340,"textCardWidth":370},
  "type":{"heading":22,"title":15,"body":13,"label":12},
  "space":{"xs":4,"sm":8,"md":12,"lg":16,"xl":20,"section":24},
  "state":{"disabledOpacity":0.42},
  "motion": {
    "duration":{"press":65,"release":220,"panelEnter":260,"panelExit":180,"content":120,"selectionTransfer":210,"bridge":160,"toast":200,"toastHold":3000,"exit":300,"reducedFade":100,"tooltipDelay":450},
    "easing":{"enter":[0.2,0.8,0.2,1],"exit":[0.4,0,1,1],"inOut":[0.4,0,0.2,1]},
    "spring":{"attention":{"stiffness":520,"damping":34},"neighbor":{"stiffness":360,"damping":30},"body":{"stiffness":260,"damping":30},"press":{"stiffness":720,"damping":34},"indicator":{"stiffness":520,"damping":38},"panel":{"stiffness":400,"damping":38}},
    "solver":{"stepMax":0.008333333333333333,"elapsedMax":0.05,"positionEpsilon":0.01,"velocityEpsilon":0.06,"sleepFrames":8},
    "proximity":{"radius":108,"localX":2.4,"localY":3.2,"maxTotalShift":4,"neighbor1":0.22,"neighbor2":0.07,"bodyShift":0.7,"bodyBulge":2,"faceStretch":0.045,"hoverScale":0.025,"leaveThreshold":0.001},
    "bridge":{"maxLinks":1,"maxGap":14,"neck":4,"maxPanelSpan":48,"opacity":0.40,"minAttention":0.12,"exclude":["complete","dismiss","danger","disabled"],"trigger":"crossing-or-explicit-transition-only"},
    "press":{"scaleX":1.045,"scaleY":0.90,"neighborImpulse":0.45},
    "intensity":{"hero":1,"editing":0.55,"system":0.20,"reading":0},
    "reduced":{"translation":0,"deformation":0,"bridges":false,"parallax":false,"ambientLoop":false},
    "quality":{"full":{"bridges":true,"pointerGlow":true},"economy":{"bridges":false,"pointerGlow":false}},
    "budget":{"inputAcknowledgeTarget":50,"releaseToFirstClickableTarget":120,"releaseToAllClickableMax":220,"settleMax":500,"confirmedSuccessToHiddenMax":380,"cancelToHiddenMax":300,"reducedTransitionMax":120},
    "policy":{"stationaryHitTargets":true,"pressFreezesAttention":true,"hoverNeverSelects":true,"persistentActiveIndependent":true,"noIdleLoop":true,"systemReduceCannotBeOverridden":true,"completeAfterHostAck":true,"generationGuard":true}
  },
  "layout":{"safeInset":16,"panelGap":14,"readerMinWidth":300,"readerMinHeight":240,"readerPreferredWidth":610,"readerPreferredHeight":470,"readerFontMin":16,"readerFontMax":28},
  "scroll":{"thumb":4,"hit":10,"hideDelay":1200,"fade":160},
  "demo":{"taskMs":1400,"slowTaskMs":4000,"commitMs":460,"sourceLocale":"en","targetLocale":"zh-CN","network":false,"systemClipboard":false}
}
